01:33:34.466549 IP (tos 0x0, ttl 128, id 41099, offset 0, flags [DF], proto TCP (6), length 52)
    192.168.3.12.58038 > 192.168.3.40.22: Flags [S], cksum 0x2fcc (correct), seq 1749053889, win 64240, options [mss 1460,nop,wscale 8,nop,nop,sackOK], length 0
01:33:34.466647 IP (tos 0x0, ttl 64, id 0, offset 0, flags [DF], proto TCP (6), length 52)
    192.168.3.40.22 > 192.168.3.12.58038: Flags [S.], cksum 0x87ab (incorrect -> 0x9e26), seq 1029329979, ack 1749053890, win 64240, options [mss 1460,nop,nop,sackOK,nop,wscale 7], length 0
01:33:34.467032 IP (tos 0x0, ttl 128, id 41100, offset 0, flags [DF], proto TCP (6), length 40)
    192.168.3.12.58038 > 192.168.3.40.22: Flags [.], cksum 0xd7e8 (correct), ack 1, win 513, length 0
01:33:34.467603 IP (tos 0x0, ttl 128, id 41101, offset 0, flags [DF], proto TCP (6), length 73)
    192.168.3.12.58038 > 192.168.3.40.22: Flags [P.], cksum 0x8fa3 (correct), seq 1:34, ack 1, win 513, length 33: SSH: SSH-2.0-OpenSSH_for_Windows_9.5
01:33:34.467623 IP (tos 0x0, ttl 64, id 41890, offset 0, flags [DF], proto TCP (6), length 40)
    192.168.3.40.22 > 192.168.3.12.58038: Flags [.], cksum 0x879f (incorrect -> 0xd7d2), ack 34, win 502, length 0
01:33:34.477253 IP (tos 0x0, ttl 64, id 41891, offset 0, flags [DF], proto TCP (6), length 80)
    192.168.3.40.22 > 192.168.3.12.58038: Flags [P.], cksum 0x87c7 (incorrect -> 0x72d1), seq 1:41, ack 34, win 502, length 40: SSH: SSH-2.0-OpenSSH_9.2p1 Debian-2+deb12u3
01:33:34.480487 IP (tos 0x0, ttl 128, id 41102, offset 0, flags [DF], proto TCP (6), length 1472)
    192.168.3.12.58038 > 192.168.3.40.22: Flags [P.], cksum 0x3ced (correct), seq 34:1466, ack 41, win 513, length 1432
01:33:34.480550 IP (tos 0x0, ttl 64, id 41892, offset 0, flags [DF], proto TCP (6), length 1152)
    192.168.3.40.22 > 192.168.3.12.58038: Flags [P.], cksum 0x8bf7 (incorrect -> 0x4145), seq 41:1153, ack 1466, win 501, length 1112
01:33:34.482534 IP (tos 0x0, ttl 128, id 41103, offset 0, flags [DF], proto TCP (6), length 88)
    192.168.3.12.58038 > 192.168.3.40.22: Flags [P.], cksum 0x27b7 (correct), seq 1466:1514, ack 1153, win 508, length 48
01:33:34.486369 IP (tos 0x0, ttl 64, id 41893, offset 0, flags [DF], proto TCP (6), length 564)
    192.168.3.40.22 > 192.168.3.12.58038: Flags [P.], cksum 0x89ab (incorrect -> 0x9bc5), seq 1153:1677, ack 1514, win 501, length 524
01:33:34.491194 IP (tos 0x0, ttl 128, id 41104, offset 0, flags [DF], proto TCP (6), length 56)
    192.168.3.12.58038 > 192.168.3.40.22: Flags [P.], cksum 0xc13a (correct), seq 1514:1530, ack 1677, win 513, length 16
01:33:34.535198 IP (tos 0x0, ttl 64, id 41894, offset 0, flags [DF], proto TCP (6), length 40)
    192.168.3.40.22 > 192.168.3.12.58038: Flags [.], cksum 0x879f (incorrect -> 0xcb6f), ack 1530, win 501, length 0
01:33:34.535770 IP (tos 0x0, ttl 128, id 41105, offset 0, flags [DF], proto TCP (6), length 84)
    192.168.3.12.58038 > 192.168.3.40.22: Flags [P.], cksum 0x470f (correct), seq 1530:1574, ack 1677, win 513, length 44
01:33:34.535872 IP (tos 0x0, ttl 64, id 41895, offset 0, flags [DF], proto TCP (6), length 40)
    192.168.3.40.22 > 192.168.3.12.58038: Flags [.], cksum 0x879f (incorrect -> 0xcb43), ack 1574, win 501, length 0
01:33:34.536117 IP (tos 0x0, ttl 64, id 41896, offset 0, flags [DF], proto TCP (6), length 84)
    192.168.3.40.22 > 192.168.3.12.58038: Flags [P.], cksum 0x87cb (incorrect -> 0x69ca), seq 1677:1721, ack 1574, win 501, length 44
01:33:34.536746 IP (tos 0x0, ttl 128, id 41106, offset 0, flags [DF], proto TCP (6), length 108)
    192.168.3.12.58038 > 192.168.3.40.22: Flags [P.], cksum 0xba0b (correct), seq 1574:1642, ack 1721, win 513, length 68
01:33:34.546897 IP (tos 0x0, ttl 64, id 41897, offset 0, flags [DF], proto TCP (6), length 92)
    192.168.3.40.22 > 192.168.3.12.58038: Flags [P.], cksum 0x87d3 (incorrect -> 0xcf4d), seq 1721:1773, ack 1642, win 501, length 52
01:33:34.547510 IP (tos 0x0, ttl 128, id 41107, offset 0, flags [DF], proto TCP (6), length 180)
    192.168.3.12.58038 > 192.168.3.40.22: Flags [P.], cksum 0x3834 (correct), seq 1642:1782, ack 1773, win 512, length 140
01:33:34.549802 IP (tos 0x0, ttl 64, id 41898, offset 0, flags [DF], proto TCP (6), length 140)
    192.168.3.40.22 > 192.168.3.12.58038: Flags [P.], cksum 0x8803 (incorrect -> 0xd9af), seq 1773:1873, ack 1782, win 501, length 100
01:33:34.588644 IP (tos 0x0, ttl 128, id 41108, offset 0, flags [DF], proto TCP (6), length 348)
    192.168.3.12.58038 > 192.168.3.40.22: Flags [P.], cksum 0xd0e4 (correct), seq 1782:2090, ack 1873, win 512, length 308
01:33:34.599162 IP (tos 0x0, ttl 64, id 41899, offset 0, flags [DF], proto TCP (6), length 68)
    192.168.3.40.22 > 192.168.3.12.58038: Flags [P.], cksum 0x87bb (incorrect -> 0x7a17), seq 1873:1901, ack 2090, win 501, length 28
01:33:34.611161 IP (tos 0x0, ttl 128, id 41109, offset 0, flags [DF], proto TCP (6), length 152)
    192.168.3.12.58038 > 192.168.3.40.22: Flags [P.], cksum 0x44c1 (correct), seq 2090:2202, ack 1901, win 512, length 112
01:33:34.638886 IP (tos 0x0, ttl 64, id 41900, offset 0, flags [DF], proto TCP (6), length 816)
    192.168.3.40.22 > 192.168.3.12.58038: Flags [P.], cksum 0x8aa7 (incorrect -> 0xbc56), seq 1901:2677, ack 2202, win 501, length 776
01:33:34.680131 IP (tos 0x0, ttl 128, id 41110, offset 0, flags [DF], proto TCP (6), length 40)
    192.168.3.12.58038 > 192.168.3.40.22: Flags [.], cksum 0xc4df (correct), ack 2677, win 509, length 0
01:33:34.680170 IP (tos 0x0, ttl 64, id 41901, offset 0, flags [DF], proto TCP (6), length 232)
    192.168.3.40.22 > 192.168.3.12.58038: Flags [P.], cksum 0x885f (incorrect -> 0xedb7), seq 2677:2869, ack 2202, win 501, length 192
01:33:34.680807 IP (tos 0x0, ttl 128, id 41111, offset 0, flags [DF], proto TCP (6), length 176)
    192.168.3.12.58038 > 192.168.3.40.22: Flags [P.], cksum 0xcddd (correct), seq 2202:2338, ack 2869, win 508, length 136
01:33:34.683919 IP (tos 0x10, ttl 64, id 41902, offset 0, flags [DF], proto TCP (6), length 148)
    192.168.3.40.22 > 192.168.3.12.58038: Flags [P.], cksum 0x880b (incorrect -> 0xf3f5), seq 2869:2977, ack 2338, win 501, length 108
01:33:34.684836 IP (tos 0x10, ttl 64, id 41903, offset 0, flags [DF], proto TCP (6), length 524)
    192.168.3.40.22 > 192.168.3.12.58038: Flags [P.], cksum 0x8983 (incorrect -> 0xd651), seq 2977:3461, ack 2338, win 501, length 484
01:33:34.685607 IP (tos 0x0, ttl 128, id 41112, offset 0, flags [DF], proto TCP (6), length 40)
    192.168.3.12.58038 > 192.168.3.40.22: Flags [.], cksum 0xc143 (correct), ack 3461, win 513, length 0
01:33:34.720967 IP (tos 0x10, ttl 64, id 41904, offset 0, flags [DF], proto TCP (6), length 156)
    192.168.3.40.22 > 192.168.3.12.58038: Flags [P.], cksum 0x8813 (incorrect -> 0x987d), seq 3461:3577, ack 2338, win 501, length 116
01:33:34.762293 IP (tos 0x0, ttl 128, id 41113, offset 0, flags [DF], proto TCP (6), length 40)
    192.168.3.12.58038 > 192.168.3.40.22: Flags [.], cksum 0xc0d0 (correct), ack 3577, win 512, length 0
01:34:54.267719 IP (tos 0x0, ttl 128, id 41114, offset 0, flags [DF], proto TCP (6), length 76)
    192.168.3.12.58038 > 192.168.3.40.22: Flags [P.], cksum 0x1373 (correct), seq 2338:2374, ack 3577, win 4100, length 36
01:34:54.268856 IP (tos 0x10, ttl 64, id 41905, offset 0, flags [DF], proto TCP (6), length 76)
    192.168.3.40.22 > 192.168.3.12.58038: Flags [P.], cksum 0x87c3 (incorrect -> 0x663e), seq 3577:3613, ack 2374, win 501, length 36
01:34:54.309113 IP (tos 0x0, ttl 128, id 41115, offset 0, flags [DF], proto TCP (6), length 40)
    192.168.3.12.58038 > 192.168.3.40.22: Flags [.], cksum 0xb284 (correct), ack 3613, win 4100, length 0
01:34:54.431132 IP (tos 0x0, ttl 128, id 41116, offset 0, flags [DF], proto TCP (6), length 76)
    192.168.3.12.58038 > 192.168.3.40.22: Flags [P.], cksum 0xc405 (correct), seq 2374:2410, ack 3613, win 4100, length 36
01:34:54.431347 IP (tos 0x10, ttl 64, id 41906, offset 0, flags [DF], proto TCP (6), length 76)
    192.168.3.40.22 > 192.168.3.12.58038: Flags [P.], cksum 0x87c3 (incorrect -> 0xf9a6), seq 3613:3649, ack 2410, win 501, length 36
01:34:54.472959 IP (tos 0x0, ttl 128, id 41117, offset 0, flags [DF], proto TCP (6), length 40)
    192.168.3.12.58038 > 192.168.3.40.22: Flags [.], cksum 0xb23c (correct), ack 3649, win 4100, length 0
01:34:54.529538 IP (tos 0x0, ttl 128, id 41118, offset 0, flags [DF], proto TCP (6), length 76)
    192.168.3.12.58038 > 192.168.3.40.22: Flags [P.], cksum 0x1cfb (correct), seq 2410:2446, ack 3649, win 4100, length 36
01:34:54.529858 IP (tos 0x10, ttl 64, id 41907, offset 0, flags [DF], proto TCP (6), length 76)
    192.168.3.40.22 > 192.168.3.12.58038: Flags [P.], cksum 0x87c3 (incorrect -> 0x32e9), seq 3649:3685, ack 2446, win 501, length 36
01:34:54.570791 IP (tos 0x0, ttl 128, id 41119, offset 0, flags [DF], proto TCP (6), length 40)
    192.168.3.12.58038 > 192.168.3.40.22: Flags [.], cksum 0xb1f4 (correct), ack 3685, win 4100, length 0
01:34:54.963703 IP (tos 0x0, ttl 128, id 41120, offset 0, flags [DF], proto TCP (6), length 76)
    192.168.3.12.58038 > 192.168.3.40.22: Flags [P.], cksum 0x9a32 (correct), seq 2446:2482, ack 3685, win 4100, length 36
01:34:54.964293 IP (tos 0x10, ttl 64, id 41908, offset 0, flags [DF], proto TCP (6), length 84)
    192.168.3.40.22 > 192.168.3.12.58038: Flags [P.], cksum 0x87cb (incorrect -> 0x6150), seq 3685:3729, ack 2482, win 501, length 44
01:34:55.005255 IP (tos 0x0, ttl 128, id 41121, offset 0, flags [DF], proto TCP (6), length 40)
    192.168.3.12.58038 > 192.168.3.40.22: Flags [.], cksum 0xb1a5 (correct), ack 3729, win 4099, length 0
01:34:55.102762 IP (tos 0x0, ttl 128, id 41122, offset 0, flags [DF], proto TCP (6), length 76)
    192.168.3.12.58038 > 192.168.3.40.22: Flags [P.], cksum 0xcc64 (correct), seq 2482:2518, ack 3729, win 4099, length 36
01:34:55.146703 IP (tos 0x10, ttl 64, id 41909, offset 0, flags [DF], proto TCP (6), length 84)
    192.168.3.40.22 > 192.168.3.12.58038: Flags [P.], cksum 0x87cb (incorrect -> 0x57c7), seq 3729:3773, ack 2518, win 501, length 44
01:34:55.187897 IP (tos 0x0, ttl 128, id 41123, offset 0, flags [DF], proto TCP (6), length 40)
    192.168.3.12.58038 > 192.168.3.40.22: Flags [.], cksum 0xb155 (correct), ack 3773, win 4099, length 0
01:34:55.254799 IP (tos 0x0, ttl 128, id 41124, offset 0, flags [DF], proto TCP (6), length 76)
    192.168.3.12.58038 > 192.168.3.40.22: Flags [P.], cksum 0x6dda (correct), seq 2518:2554, ack 3773, win 4099, length 36
01:34:55.255062 IP (tos 0x10, ttl 64, id 41910, offset 0, flags [DF], proto TCP (6), length 84)
    192.168.3.40.22 > 192.168.3.12.58038: Flags [P.], cksum 0x87cb (incorrect -> 0xbd7f), seq 3773:3817, ack 2554, win 501, length 44
01:34:55.297055 IP (tos 0x0, ttl 128, id 41125, offset 0, flags [DF], proto TCP (6), length 40)
    192.168.3.12.58038 > 192.168.3.40.22: Flags [.], cksum 0xb105 (correct), ack 3817, win 4099, length 0
01:34:55.365237 IP (tos 0x0, ttl 128, id 41126, offset 0, flags [DF], proto TCP (6), length 76)
    192.168.3.12.58038 > 192.168.3.40.22: Flags [P.], cksum 0x52e1 (correct), seq 2554:2590, ack 3817, win 4099, length 36
01:34:55.365651 IP (tos 0x10, ttl 64, id 41911, offset 0, flags [DF], proto TCP (6), length 76)
    192.168.3.40.22 > 192.168.3.12.58038: Flags [P.], cksum 0x87c3 (incorrect -> 0xa81a), seq 3817:3853, ack 2590, win 501, length 36
01:34:55.410320 IP (tos 0x0, ttl 128, id 41127, offset 0, flags [DF], proto TCP (6), length 40)
    192.168.3.12.58038 > 192.168.3.40.22: Flags [.], cksum 0xb0bd (correct), ack 3853, win 4099, length 0
01:34:55.953452 IP (tos 0x0, ttl 128, id 41128, offset 0, flags [DF], proto TCP (6), length 76)
    192.168.3.12.58038 > 192.168.3.40.22: Flags [P.], cksum 0x9dab (correct), seq 2590:2626, ack 3853, win 4099, length 36
01:34:55.954405 IP (tos 0x10, ttl 64, id 41912, offset 0, flags [DF], proto TCP (6), length 76)
    192.168.3.40.22 > 192.168.3.12.58038: Flags [P.], cksum 0x87c3 (incorrect -> 0x25b6), seq 3853:3889, ack 2626, win 501, length 36
01:34:55.996200 IP (tos 0x0, ttl 128, id 41129, offset 0, flags [DF], proto TCP (6), length 40)
    192.168.3.12.58038 > 192.168.3.40.22: Flags [.], cksum 0xb075 (correct), ack 3889, win 4099, length 0
01:34:56.101905 IP (tos 0x0, ttl 128, id 41130, offset 0, flags [DF], proto TCP (6), length 76)
    192.168.3.12.58038 > 192.168.3.40.22: Flags [P.], cksum 0x78bf (correct), seq 2626:2662, ack 3889, win 4099, length 36
01:34:56.102360 IP (tos 0x10, ttl 64, id 41913, offset 0, flags [DF], proto TCP (6), length 76)
    192.168.3.40.22 > 192.168.3.12.58038: Flags [P.], cksum 0x87c3 (incorrect -> 0x6f6a), seq 3889:3925, ack 2662, win 501, length 36
01:34:56.143188 IP (tos 0x0, ttl 128, id 41131, offset 0, flags [DF], proto TCP (6), length 40)
    192.168.3.12.58038 > 192.168.3.40.22: Flags [.], cksum 0xb02d (correct), ack 3925, win 4099, length 0
01:34:56.685728 IP (tos 0x0, ttl 128, id 41132, offset 0, flags [DF], proto TCP (6), length 76)
    192.168.3.12.58038 > 192.168.3.40.22: Flags [P.], cksum 0x2e04 (correct), seq 2662:2698, ack 3925, win 4099, length 36
01:34:56.688199 IP (tos 0x10, ttl 64, id 41914, offset 0, flags [DF], proto TCP (6), length 76)
    192.168.3.40.22 > 192.168.3.12.58038: Flags [P.], cksum 0x87c3 (incorrect -> 0x6757), seq 3925:3961, ack 2698, win 501, length 36
01:34:56.731503 IP (tos 0x0, ttl 128, id 41133, offset 0, flags [DF], proto TCP (6), length 40)
    192.168.3.12.58038 > 192.168.3.40.22: Flags [.], cksum 0xafe5 (correct), ack 3961, win 4099, length 0
01:34:56.866305 IP (tos 0x0, ttl 128, id 41134, offset 0, flags [DF], proto TCP (6), length 76)
    192.168.3.12.58038 > 192.168.3.40.22: Flags [P.], cksum 0x03c2 (correct), seq 2698:2734, ack 3961, win 4099, length 36
01:34:56.867323 IP (tos 0x10, ttl 64, id 41915, offset 0, flags [DF], proto TCP (6), length 76)
    192.168.3.40.22 > 192.168.3.12.58038: Flags [P.], cksum 0x87c3 (incorrect -> 0x1a61), seq 3961:3997, ack 2734, win 501, length 36
01:34:56.908914 IP (tos 0x0, ttl 128, id 41135, offset 0, flags [DF], proto TCP (6), length 40)
    192.168.3.12.58038 > 192.168.3.40.22: Flags [.], cksum 0xaf9e (correct), ack 3997, win 4098, length 0
01:34:57.024280 IP (tos 0x0, ttl 128, id 41136, offset 0, flags [DF], proto TCP (6), length 76)
    192.168.3.12.58038 > 192.168.3.40.22: Flags [P.], cksum 0x35bb (correct), seq 2734:2770, ack 3997, win 4098, length 36
01:34:57.025872 IP (tos 0x10, ttl 64, id 41916, offset 0, flags [DF], proto TCP (6), length 76)
    192.168.3.40.22 > 192.168.3.12.58038: Flags [P.], cksum 0x87c3 (incorrect -> 0x4b09), seq 3997:4033, ack 2770, win 501, length 36
01:34:57.067207 IP (tos 0x0, ttl 128, id 41137, offset 0, flags [DF], proto TCP (6), length 40)
    192.168.3.12.58038 > 192.168.3.40.22: Flags [.], cksum 0xaf56 (correct), ack 4033, win 4098, length 0
01:34:57.586247 IP (tos 0x0, ttl 128, id 41138, offset 0, flags [DF], proto TCP (6), length 76)
    192.168.3.12.58038 > 192.168.3.40.22: Flags [P.], cksum 0x82ec (correct), seq 2770:2806, ack 4033, win 4098, length 36
01:34:57.588405 IP (tos 0x10, ttl 64, id 41917, offset 0, flags [DF], proto TCP (6), length 92)
    192.168.3.40.22 > 192.168.3.12.58038: Flags [P.], cksum 0x87d3 (incorrect -> 0xceff), seq 4033:4085, ack 2806, win 501, length 52
01:34:57.593496 IP (tos 0x10, ttl 64, id 41918, offset 0, flags [DF], proto TCP (6), length 500)
    192.168.3.40.22 > 192.168.3.12.58038: Flags [P.], cksum 0x896b (incorrect -> 0x3d3c), seq 4085:4545, ack 2806, win 501, length 460
01:34:57.594453 IP (tos 0x0, ttl 128, id 41139, offset 0, flags [DF], proto TCP (6), length 40)
    192.168.3.12.58038 > 192.168.3.40.22: Flags [.], cksum 0xad34 (correct), ack 4545, win 4096, length 0
01:34:57.594796 IP (tos 0x10, ttl 64, id 41919, offset 0, flags [DF], proto TCP (6), length 156)
    192.168.3.40.22 > 192.168.3.12.58038: Flags [P.], cksum 0x8813 (incorrect -> 0x1a86), seq 4545:4661, ack 2806, win 501, length 116
01:34:57.641238 IP (tos 0x0, ttl 128, id 41140, offset 0, flags [DF], proto TCP (6), length 40)
    192.168.3.12.58038 > 192.168.3.40.22: Flags [.], cksum 0xacc0 (correct), ack 4661, win 4096, length 0
01:35:35.129644 IP (tos 0x0, ttl 128, id 41141, offset 0, flags [DF], proto TCP (6), length 52)
    192.168.3.12.58040 > 192.168.3.40.22: Flags [S], cksum 0x6a2b (correct), seq 1503217159, win 64240, options [mss 1460,nop,wscale 8,nop,nop,sackOK], length 0
01:35:35.129850 IP (tos 0x0, ttl 64, id 0, offset 0, flags [DF], proto TCP (6), length 52)
    192.168.3.40.22 > 192.168.3.12.58040: Flags [S.], cksum 0x87ab (incorrect -> 0x88f5), seq 2410303867, ack 1503217160, win 64240, options [mss 1460,nop,nop,sackOK,nop,wscale 7], length 0
01:35:35.130513 IP (tos 0x0, ttl 128, id 41142, offset 0, flags [DF], proto TCP (6), length 40)
    192.168.3.12.58040 > 192.168.3.40.22: Flags [.], cksum 0xc2b7 (correct), ack 1, win 513, length 0
01:35:35.132120 IP (tos 0x0, ttl 128, id 41143, offset 0, flags [DF], proto TCP (6), length 73)
    192.168.3.12.58040 > 192.168.3.40.22: Flags [P.], cksum 0x7a72 (correct), seq 1:34, ack 1, win 513, length 33: SSH: SSH-2.0-OpenSSH_for_Windows_9.5
01:35:35.132136 IP (tos 0x0, ttl 64, id 60989, offset 0, flags [DF], proto TCP (6), length 40)
    192.168.3.40.22 > 192.168.3.12.58040: Flags [.], cksum 0x879f (incorrect -> 0xc2a1), ack 34, win 502, length 0
01:35:35.140824 IP (tos 0x0, ttl 64, id 60990, offset 0, flags [DF], proto TCP (6), length 80)
    192.168.3.40.22 > 192.168.3.12.58040: Flags [P.], cksum 0x87c7 (incorrect -> 0x5da0), seq 1:41, ack 34, win 502, length 40: SSH: SSH-2.0-OpenSSH_9.2p1 Debian-2+deb12u3
01:35:35.193338 IP (tos 0x0, ttl 128, id 41144, offset 0, flags [DF], proto TCP (6), length 1472)
    192.168.3.12.58040 > 192.168.3.40.22: Flags [P.], cksum 0xa669 (correct), seq 34:1466, ack 41, win 513, length 1432
01:35:35.193405 IP (tos 0x0, ttl 64, id 60991, offset 0, flags [DF], proto TCP (6), length 1152)
    192.168.3.40.22 > 192.168.3.12.58040: Flags [P.], cksum 0x8bf7 (incorrect -> 0x24db), seq 41:1153, ack 1466, win 501, length 1112
01:35:35.196000 IP (tos 0x0, ttl 128, id 41145, offset 0, flags [DF], proto TCP (6), length 88)
    192.168.3.12.58040 > 192.168.3.40.22: Flags [P.], cksum 0xe21b (correct), seq 1466:1514, ack 1153, win 508, length 48
01:35:35.200706 IP (tos 0x0, ttl 64, id 60992, offset 0, flags [DF], proto TCP (6), length 564)
    192.168.3.40.22 > 192.168.3.12.58040: Flags [P.], cksum 0x89ab (incorrect -> 0x09fe), seq 1153:1677, ack 1514, win 501, length 524
01:35:35.205697 IP (tos 0x0, ttl 128, id 41146, offset 0, flags [DF], proto TCP (6), length 56)
    192.168.3.12.58040 > 192.168.3.40.22: Flags [P.], cksum 0xac09 (correct), seq 1514:1530, ack 1677, win 513, length 16
01:35:35.251580 IP (tos 0x0, ttl 64, id 60993, offset 0, flags [DF], proto TCP (6), length 40)
    192.168.3.40.22 > 192.168.3.12.58040: Flags [.], cksum 0x879f (incorrect -> 0xb63e), ack 1530, win 501, length 0
01:35:35.252148 IP (tos 0x0, ttl 128, id 41147, offset 0, flags [DF], proto TCP (6), length 84)
    192.168.3.12.58040 > 192.168.3.40.22: Flags [P.], cksum 0x980b (correct), seq 1530:1574, ack 1677, win 513, length 44
01:35:35.252216 IP (tos 0x0, ttl 64, id 60994, offset 0, flags [DF], proto TCP (6), length 40)
    192.168.3.40.22 > 192.168.3.12.58040: Flags [.], cksum 0x879f (incorrect -> 0xb612), ack 1574, win 501, length 0
01:35:35.252506 IP (tos 0x0, ttl 64, id 60995, offset 0, flags [DF], proto TCP (6), length 84)
    192.168.3.40.22 > 192.168.3.12.58040: Flags [P.], cksum 0x87cb (incorrect -> 0x1a62), seq 1677:1721, ack 1574, win 501, length 44
01:35:35.252945 IP (tos 0x0, ttl 128, id 41148, offset 0, flags [DF], proto TCP (6), length 108)
    192.168.3.12.58040 > 192.168.3.40.22: Flags [P.], cksum 0x915e (correct), seq 1574:1642, ack 1721, win 513, length 68
01:35:35.294692 IP (tos 0x0, ttl 64, id 60996, offset 0, flags [DF], proto TCP (6), length 92)
    192.168.3.40.22 > 192.168.3.12.58040: Flags [P.], cksum 0x87d3 (incorrect -> 0x1943), seq 1721:1773, ack 1642, win 501, length 52
01:35:35.340464 IP (tos 0x0, ttl 128, id 41149, offset 0, flags [DF], proto TCP (6), length 40)
    192.168.3.12.58040 > 192.168.3.40.22: Flags [.], cksum 0xb563 (correct), ack 1773, win 512, length 0
01:35:45.811802 IP (tos 0x0, ttl 128, id 41150, offset 0, flags [DF], proto TCP (6), length 124)
    192.168.3.12.58040 > 192.168.3.40.22: Flags [P.], cksum 0xc407 (correct), seq 1642:1726, ack 1773, win 512, length 84
01:35:45.844114 IP (tos 0x0, ttl 64, id 60997, offset 0, flags [DF], proto TCP (6), length 68)
    192.168.3.40.22 > 192.168.3.12.58040: Flags [P.], cksum 0x87bb (incorrect -> 0xcdd2), seq 1773:1801, ack 1726, win 501, length 28
01:35:45.844831 IP (tos 0x0, ttl 128, id 41151, offset 0, flags [DF], proto TCP (6), length 152)
    192.168.3.12.58040 > 192.168.3.40.22: Flags [P.], cksum 0x07fd (correct), seq 1726:1838, ack 1801, win 512, length 112
01:35:45.886385 IP (tos 0x0, ttl 64, id 60998, offset 0, flags [DF], proto TCP (6), length 40)
    192.168.3.40.22 > 192.168.3.12.58040: Flags [.], cksum 0x879f (incorrect -> 0xb48e), ack 1838, win 501, length 0
01:35:45.891717 IP (tos 0x0, ttl 64, id 60999, offset 0, flags [DF], proto TCP (6), length 668)
    192.168.3.40.22 > 192.168.3.12.58040: Flags [P.], cksum 0x8a13 (incorrect -> 0xafa4), seq 1801:2429, ack 1838, win 501, length 628
01:35:45.932740 IP (tos 0x0, ttl 128, id 41152, offset 0, flags [DF], proto TCP (6), length 40)
    192.168.3.12.58040 > 192.168.3.40.22: Flags [.], cksum 0xb211 (correct), ack 2429, win 510, length 0
01:35:45.932771 IP (tos 0x0, ttl 64, id 61000, offset 0, flags [DF], proto TCP (6), length 84)
    192.168.3.40.22 > 192.168.3.12.58040: Flags [P.], cksum 0x87cb (incorrect -> 0x108c), seq 2429:2473, ack 1838, win 501, length 44
01:35:45.933672 IP (tos 0x0, ttl 128, id 41153, offset 0, flags [DF], proto TCP (6), length 92)
    192.168.3.12.58040 > 192.168.3.40.22: Flags [P.], cksum 0x8c3c (correct), seq 1838:1890, ack 2473, win 510, length 52
01:35:45.933698 IP (tos 0x0, ttl 64, id 61001, offset 0, flags [DF], proto TCP (6), length 40)
    192.168.3.40.22 > 192.168.3.12.58040: Flags [.], cksum 0x879f (incorrect -> 0xb1ba), ack 1890, win 501, length 0
01:35:45.935565 IP (tos 0x8, ttl 64, id 61002, offset 0, flags [DF], proto TCP (6), length 112)
    192.168.3.40.22 > 192.168.3.12.58040: Flags [P.], cksum 0x87e7 (incorrect -> 0x82fa), seq 2473:2545, ack 1890, win 501, length 72
01:35:45.935857 IP (tos 0x0, ttl 128, id 41154, offset 0, flags [DF], proto TCP (6), length 84)
    192.168.3.12.58040 > 192.168.3.40.22: Flags [P.], cksum 0xa27a (correct), seq 1890:1934, ack 2545, win 509, length 44
01:35:45.940588 IP (tos 0x8, ttl 64, id 61003, offset 0, flags [DF], proto TCP (6), length 396)
    192.168.3.40.22 > 192.168.3.12.58040: Flags [P.], cksum 0x8903 (incorrect -> 0x8406), seq 2545:2901, ack 1934, win 501, length 356
01:35:45.941536 IP (tos 0x0, ttl 128, id 41155, offset 0, flags [DF], proto TCP (6), length 84)
    192.168.3.12.58040 > 192.168.3.40.22: Flags [P.], cksum 0x31b2 (correct), seq 1934:1978, ack 2901, win 508, length 44
01:35:45.941537 IP (tos 0x0, ttl 128, id 41156, offset 0, flags [DF], proto TCP (6), length 108)
    192.168.3.12.58040 > 192.168.3.40.22: Flags [P.], cksum 0x9e44 (correct), seq 1978:2046, ack 2901, win 508, length 68
01:35:45.941619 IP (tos 0x8, ttl 64, id 61004, offset 0, flags [DF], proto TCP (6), length 40)
    192.168.3.40.22 > 192.168.3.12.58040: Flags [.], cksum 0x879f (incorrect -> 0xaf72), ack 2046, win 501, length 0
01:35:45.942516 IP (tos 0x8, ttl 64, id 61005, offset 0, flags [DF], proto TCP (6), length 116)
    192.168.3.40.22 > 192.168.3.12.58040: Flags [P.], cksum 0x87eb (incorrect -> 0x5d90), seq 2901:2977, ack 2046, win 501, length 76
01:35:45.943724 IP (tos 0x0, ttl 128, id 41157, offset 0, flags [DF], proto TCP (6), length 84)
    192.168.3.12.58040 > 192.168.3.40.22: Flags [P.], cksum 0x8853 (correct), seq 2046:2090, ack 2977, win 508, length 44
01:35:45.943725 IP (tos 0x0, ttl 128, id 41158, offset 0, flags [DF], proto TCP (6), length 100)
    192.168.3.12.58040 > 192.168.3.40.22: Flags [P.], cksum 0xc9e6 (correct), seq 2090:2150, ack 2977, win 508, length 60
01:35:45.943830 IP (tos 0x8, ttl 64, id 61006, offset 0, flags [DF], proto TCP (6), length 40)
    192.168.3.40.22 > 192.168.3.12.58040: Flags [.], cksum 0x879f (incorrect -> 0xaebe), ack 2150, win 501, length 0
01:35:45.944582 IP (tos 0x8, ttl 64, id 61007, offset 0, flags [DF], proto TCP (6), length 116)
    192.168.3.40.22 > 192.168.3.12.58040: Flags [P.], cksum 0x87eb (incorrect -> 0x209f), seq 2977:3053, ack 2150, win 501, length 76
01:35:45.947460 IP (tos 0x0, ttl 128, id 41159, offset 0, flags [DF], proto TCP (6), length 84)
    192.168.3.12.58040 > 192.168.3.40.22: Flags [P.], cksum 0x1935 (correct), seq 2150:2194, ack 3053, win 507, length 44
01:35:45.947463 IP (tos 0x0, ttl 128, id 41160, offset 0, flags [DF], proto TCP (6), length 132)
    192.168.3.12.58040 > 192.168.3.40.22: Flags [P.], cksum 0xcf5d (correct), seq 2194:2286, ack 3053, win 507, length 92
01:35:45.947600 IP (tos 0x8, ttl 64, id 61008, offset 0, flags [DF], proto TCP (6), length 40)
    192.168.3.40.22 > 192.168.3.12.58040: Flags [.], cksum 0x879f (incorrect -> 0xadea), ack 2286, win 501, length 0
01:35:45.948479 IP (tos 0x8, ttl 64, id 61009, offset 0, flags [DF], proto TCP (6), length 92)
    192.168.3.40.22 > 192.168.3.12.58040: Flags [P.], cksum 0x87d3 (incorrect -> 0x7799), seq 3053:3105, ack 2286, win 501, length 52
01:35:45.950646 IP (tos 0x0, ttl 128, id 41161, offset 0, flags [DF], proto TCP (6), length 84)
    192.168.3.12.58040 > 192.168.3.40.22: Flags [P.], cksum 0xb9be (correct), seq 2286:2330, ack 3105, win 507, length 44
01:35:45.950648 IP (tos 0x0, ttl 128, id 41162, offset 0, flags [DF], proto TCP (6), length 228)
    192.168.3.12.58040 > 192.168.3.40.22: Flags [P.], cksum 0xb97f (correct), seq 2330:2518, ack 3105, win 507, length 188
01:35:45.950777 IP (tos 0x8, ttl 64, id 61010, offset 0, flags [DF], proto TCP (6), length 40)
    192.168.3.40.22 > 192.168.3.12.58040: Flags [.], cksum 0x879f (incorrect -> 0xacce), ack 2518, win 501, length 0
01:35:45.951576 IP (tos 0x8, ttl 64, id 61011, offset 0, flags [DF], proto TCP (6), length 108)
    192.168.3.40.22 > 192.168.3.12.58040: Flags [P.], cksum 0x87e3 (incorrect -> 0xb338), seq 3105:3173, ack 2518, win 501, length 68
01:35:45.953415 IP (tos 0x0, ttl 128, id 41163, offset 0, flags [DF], proto TCP (6), length 84)
    192.168.3.12.58040 > 192.168.3.40.22: Flags [P.], cksum 0xbc2a (correct), seq 2518:2562, ack 3173, win 513, length 44
01:35:45.953417 IP (tos 0x0, ttl 128, id 41164, offset 0, flags [DF], proto TCP (6), length 100)
    192.168.3.12.58040 > 192.168.3.40.22: Flags [P.], cksum 0x75bc (correct), seq 2562:2622, ack 3173, win 513, length 60
01:35:45.953561 IP (tos 0x8, ttl 64, id 61012, offset 0, flags [DF], proto TCP (6), length 40)
    192.168.3.40.22 > 192.168.3.12.58040: Flags [.], cksum 0x879f (incorrect -> 0xac22), ack 2622, win 501, length 0
01:35:45.954708 IP (tos 0x8, ttl 64, id 61013, offset 0, flags [DF], proto TCP (6), length 108)
    192.168.3.40.22 > 192.168.3.12.58040: Flags [P.], cksum 0x87e3 (incorrect -> 0x0cb5), seq 3173:3241, ack 2622, win 501, length 68
01:35:45.955275 IP (tos 0x0, ttl 128, id 41165, offset 0, flags [DF], proto TCP (6), length 84)
    192.168.3.12.58040 > 192.168.3.40.22: Flags [P.], cksum 0x0dc3 (correct), seq 2622:2666, ack 3241, win 513, length 44
01:35:45.955276 IP (tos 0x0, ttl 128, id 41166, offset 0, flags [DF], proto TCP (6), length 92)
    192.168.3.12.58040 > 192.168.3.40.22: Flags [P.], cksum 0x27f4 (correct), seq 2666:2718, ack 3241, win 513, length 52
01:35:45.955364 IP (tos 0x8, ttl 64, id 61014, offset 0, flags [DF], proto TCP (6), length 40)
    192.168.3.40.22 > 192.168.3.12.58040: Flags [.], cksum 0x879f (incorrect -> 0xab7e), ack 2718, win 501, length 0
01:35:45.958964 IP (tos 0x8, ttl 64, id 61015, offset 0, flags [DF], proto TCP (6), length 108)
    192.168.3.40.22 > 192.168.3.12.58040: Flags [P.], cksum 0x87e3 (incorrect -> 0xb8d4), seq 3241:3309, ack 2718, win 501, length 68
01:35:45.959553 IP (tos 0x0, ttl 128, id 41167, offset 0, flags [DF], proto TCP (6), length 76)
    192.168.3.12.58040 > 192.168.3.40.22: Flags [P.], cksum 0x34c4 (correct), seq 2718:2754, ack 3309, win 512, length 36
01:35:45.960591 IP (tos 0x8, ttl 64, id 61016, offset 0, flags [DF], proto TCP (6), length 164)
    192.168.3.40.22 > 192.168.3.12.58040: Flags [P.], cksum 0x881b (incorrect -> 0x6b51), seq 3309:3433, ack 2754, win 501, length 124
01:35:45.961357 IP (tos 0x0, ttl 128, id 41168, offset 0, flags [DF], proto TCP (6), length 76)
    192.168.3.12.58040 > 192.168.3.40.22: Flags [P.], cksum 0x14ba (correct), seq 2754:2790, ack 3433, win 512, length 36
01:35:45.961358 IP (tos 0x0, ttl 128, id 41169, offset 0, flags [DF], proto TCP (6), length 100)
    192.168.3.12.58040 > 192.168.3.40.22: Flags [P.], cksum 0x2f63 (correct), seq 2790:2850, ack 3433, win 512, length 60
01:35:45.961358 IP (tos 0x0, ttl 128, id 41170, offset 0, flags [DF], proto TCP (6), length 40)
    192.168.3.12.58040 > 192.168.3.40.22: Flags [R.], cksum 0xac2b (correct), seq 2850, ack 3433, win 0, length 0
01:36:25.375848 IP (tos 0x0, ttl 128, id 41171, offset 0, flags [DF], proto TCP (6), length 76)
    192.168.3.12.58038 > 192.168.3.40.22: Flags [P.], cksum 0xf4c4 (correct), seq 2806:2842, ack 4661, win 4096, length 36
01:36:25.379213 IP (tos 0x10, ttl 64, id 41920, offset 0, flags [DF], proto TCP (6), length 76)
    192.168.3.40.22 > 192.168.3.12.58038: Flags [P.], cksum 0x87c3 (incorrect -> 0xc398), seq 4661:4697, ack 2842, win 501, length 36
01:36:25.420746 IP (tos 0x0, ttl 128, id 41172, offset 0, flags [DF], proto TCP (6), length 40)
    192.168.3.12.58038 > 192.168.3.40.22: Flags [.], cksum 0xac78 (correct), ack 4697, win 4096, length 0
01:36:25.539365 IP (tos 0x0, ttl 128, id 41173, offset 0, flags [DF], proto TCP (6), length 76)
    192.168.3.12.58038 > 192.168.3.40.22: Flags [P.], cksum 0xe95b (correct), seq 2842:2878, ack 4697, win 4096, length 36
01:36:25.555730 IP (tos 0x10, ttl 64, id 41921, offset 0, flags [DF], proto TCP (6), length 76)
    192.168.3.40.22 > 192.168.3.12.58038: Flags [P.], cksum 0x87c3 (incorrect -> 0x512a), seq 4697:4733, ack 2878, win 501, length 36
01:36:25.597157 IP (tos 0x0, ttl 128, id 41174, offset 0, flags [DF], proto TCP (6), length 40)
    192.168.3.12.58038 > 192.168.3.40.22: Flags [.], cksum 0xac30 (correct), ack 4733, win 4096, length 0
01:36:26.142409 IP (tos 0x0, ttl 128, id 41175, offset 0, flags [DF], proto TCP (6), length 76)
    192.168.3.12.58038 > 192.168.3.40.22: Flags [P.], cksum 0x0629 (correct), seq 2878:2914, ack 4733, win 4096, length 36
01:36:26.143363 IP (tos 0x10, ttl 64, id 41922, offset 0, flags [DF], proto TCP (6), length 76)
    192.168.3.40.22 > 192.168.3.12.58038: Flags [P.], cksum 0x87c3 (incorrect -> 0x0ac7), seq 4733:4769, ack 2914, win 501, length 36
01:36:26.185732 IP (tos 0x0, ttl 128, id 41176, offset 0, flags [DF], proto TCP (6), length 40)
    192.168.3.12.58038 > 192.168.3.40.22: Flags [.], cksum 0xabe9 (correct), ack 4769, win 4095, length 0
01:36:26.271525 IP (tos 0x0, ttl 128, id 41177, offset 0, flags [DF], proto TCP (6), length 76)
    192.168.3.12.58038 > 192.168.3.40.22: Flags [P.], cksum 0xe9d5 (correct), seq 2914:2950, ack 4769, win 4095, length 36
01:36:26.272066 IP (tos 0x10, ttl 64, id 41923, offset 0, flags [DF], proto TCP (6), length 76)
    192.168.3.40.22 > 192.168.3.12.58038: Flags [P.], cksum 0x87c3 (incorrect -> 0x8885), seq 4769:4805, ack 2950, win 501, length 36
01:36:26.313052 IP (tos 0x0, ttl 128, id 41178, offset 0, flags [DF], proto TCP (6), length 40)
    192.168.3.12.58038 > 192.168.3.40.22: Flags [.], cksum 0xaba1 (correct), ack 4805, win 4095, length 0
01:36:26.436641 IP (tos 0x0, ttl 128, id 41179, offset 0, flags [DF], proto TCP (6), length 76)
    192.168.3.12.58038 > 192.168.3.40.22: Flags [P.], cksum 0xebde (correct), seq 2950:2986, ack 4805, win 4095, length 36
01:36:26.437401 IP (tos 0x10, ttl 64, id 41924, offset 0, flags [DF], proto TCP (6), length 76)
    192.168.3.40.22 > 192.168.3.12.58038: Flags [P.], cksum 0x87c3 (incorrect -> 0xfce1), seq 4805:4841, ack 2986, win 501, length 36
01:36:26.479594 IP (tos 0x0, ttl 128, id 41180, offset 0, flags [DF], proto TCP (6), length 40)
    192.168.3.12.58038 > 192.168.3.40.22: Flags [.], cksum 0xab59 (correct), ack 4841, win 4095, length 0
01:36:27.887795 IP (tos 0x0, ttl 128, id 41181, offset 0, flags [DF], proto TCP (6), length 76)
    192.168.3.12.58038 > 192.168.3.40.22: Flags [P.], cksum 0x65f3 (correct), seq 2986:3022, ack 4841, win 4095, length 36
01:36:27.889595 IP (tos 0x10, ttl 64, id 41925, offset 0, flags [DF], proto TCP (6), length 92)
    192.168.3.40.22 > 192.168.3.12.58038: Flags [P.], cksum 0x87d3 (incorrect -> 0x6478), seq 4841:4893, ack 3022, win 501, length 52
01:36:27.892888 IP (tos 0x10, ttl 64, id 41926, offset 0, flags [DF], proto TCP (6), length 164)
    192.168.3.40.22 > 192.168.3.12.58038: Flags [P.], cksum 0x881b (incorrect -> 0x11d6), seq 4893:5017, ack 3022, win 501, length 124
01:36:27.893196 IP (tos 0x0, ttl 128, id 41182, offset 0, flags [DF], proto TCP (6), length 40)
    192.168.3.12.58038 > 192.168.3.40.22: Flags [.], cksum 0xaa86 (correct), ack 5017, win 4094, length 0
01:36:27.893661 IP (tos 0x10, ttl 64, id 41927, offset 0, flags [DF], proto TCP (6), length 484)
    192.168.3.40.22 > 192.168.3.12.58038: Flags [P.], cksum 0x895b (incorrect -> 0x1cb9), seq 5017:5461, ack 3022, win 501, length 444
01:36:27.893982 IP (tos 0x10, ttl 64, id 41928, offset 0, flags [DF], proto TCP (6), length 156)
    192.168.3.40.22 > 192.168.3.12.58038: Flags [P.], cksum 0x8813 (incorrect -> 0x2ac9), seq 5461:5577, ack 3022, win 501, length 116
01:36:27.894263 IP (tos 0x0, ttl 128, id 41183, offset 0, flags [DF], proto TCP (6), length 40)
    192.168.3.12.58038 > 192.168.3.40.22: Flags [.], cksum 0xa850 (correct), ack 5577, win 4100, length 0
01:36:30.128503 IP (tos 0x0, ttl 128, id 41184, offset 0, flags [DF], proto TCP (6), length 76)
    192.168.3.12.58038 > 192.168.3.40.22: Flags [P.], cksum 0x20e2 (correct), seq 3022:3058, ack 5577, win 4100, length 36
01:36:30.130092 IP (tos 0x10, ttl 64, id 41929, offset 0, flags [DF], proto TCP (6), length 76)
    192.168.3.40.22 > 192.168.3.12.58038: Flags [P.], cksum 0x87c3 (incorrect -> 0xd0b8), seq 5577:5613, ack 3058, win 501, length 36
01:36:30.218270 IP (tos 0x0, ttl 128, id 41185, offset 0, flags [DF], proto TCP (6), length 40)
    192.168.3.12.58038 > 192.168.3.40.22: Flags [.], cksum 0xa808 (correct), ack 5613, win 4100, length 0
01:36:30.270784 IP (tos 0x0, ttl 128, id 41186, offset 0, flags [DF], proto TCP (6), length 76)
    192.168.3.12.58038 > 192.168.3.40.22: Flags [P.], cksum 0x5ec9 (correct), seq 3058:3094, ack 5613, win 4100, length 36
01:36:30.283956 IP (tos 0x10, ttl 64, id 41930, offset 0, flags [DF], proto TCP (6), length 76)
    192.168.3.40.22 > 192.168.3.12.58038: Flags [P.], cksum 0x87c3 (incorrect -> 0x5dbc), seq 5613:5649, ack 3094, win 501, length 36
01:36:30.324957 IP (tos 0x0, ttl 128, id 41187, offset 0, flags [DF], proto TCP (6), length 40)
    192.168.3.12.58038 > 192.168.3.40.22: Flags [.], cksum 0xa7c0 (correct), ack 5649, win 4100, length 0
01:36:30.387444 IP (tos 0x0, ttl 128, id 41188, offset 0, flags [DF], proto TCP (6), length 76)
    192.168.3.12.58038 > 192.168.3.40.22: Flags [P.], cksum 0x2381 (correct), seq 3094:3130, ack 5649, win 4100, length 36
01:36:30.397763 IP (tos 0x10, ttl 64, id 41931, offset 0, flags [DF], proto TCP (6), length 76)
    192.168.3.40.22 > 192.168.3.12.58038: Flags [P.], cksum 0x87c3 (incorrect -> 0x4a4f), seq 5649:5685, ack 3130, win 501, length 36
01:36:30.439598 IP (tos 0x0, ttl 128, id 41189, offset 0, flags [DF], proto TCP (6), length 40)
    192.168.3.12.58038 > 192.168.3.40.22: Flags [.], cksum 0xa778 (correct), ack 5685, win 4100, length 0
01:36:30.875957 IP (tos 0x0, ttl 128, id 41190, offset 0, flags [DF], proto TCP (6), length 76)
    192.168.3.12.58038 > 192.168.3.40.22: Flags [P.], cksum 0x057f (correct), seq 3130:3166, ack 5685, win 4100, length 36
01:36:30.878436 IP (tos 0x10, ttl 64, id 41932, offset 0, flags [DF], proto TCP (6), length 76)
    192.168.3.40.22 > 192.168.3.12.58038: Flags [P.], cksum 0x87c3 (incorrect -> 0x084e), seq 5685:5721, ack 3166, win 501, length 36
01:36:30.940488 IP (tos 0x0, ttl 128, id 41191, offset 0, flags [DF], proto TCP (6), length 40)
    192.168.3.12.58038 > 192.168.3.40.22: Flags [.], cksum 0xa731 (correct), ack 5721, win 4099, length 0
01:36:31.892156 IP (tos 0x0, ttl 128, id 41192, offset 0, flags [DF], proto TCP (6), length 76)
    192.168.3.12.58038 > 192.168.3.40.22: Flags [P.], cksum 0x3c3c (correct), seq 3166:3202, ack 5721, win 4099, length 36
01:36:31.893247 IP (tos 0x10, ttl 64, id 41933, offset 0, flags [DF], proto TCP (6), length 76)
    192.168.3.40.22 > 192.168.3.12.58038: Flags [P.], cksum 0x87c3 (incorrect -> 0x47e1), seq 5721:5757, ack 3202, win 501, length 36
01:36:31.933490 IP (tos 0x0, ttl 128, id 41193, offset 0, flags [DF], proto TCP (6), length 40)
    192.168.3.12.58038 > 192.168.3.40.22: Flags [.], cksum 0xa6e9 (correct), ack 5757, win 4099, length 0
01:36:32.141767 IP (tos 0x0, ttl 128, id 41194, offset 0, flags [DF], proto TCP (6), length 76)
    192.168.3.12.58038 > 192.168.3.40.22: Flags [P.], cksum 0xff6d (correct), seq 3202:3238, ack 5757, win 4099, length 36
01:36:32.149575 IP (tos 0x10, ttl 64, id 41934, offset 0, flags [DF], proto TCP (6), length 92)
    192.168.3.40.22 > 192.168.3.12.58038: Flags [P.], cksum 0x87d3 (incorrect -> 0x36e0), seq 5757:5809, ack 3238, win 501, length 52
01:36:32.190923 IP (tos 0x0, ttl 128, id 41195, offset 0, flags [DF], proto TCP (6), length 40)
    192.168.3.12.58038 > 192.168.3.40.22: Flags [.], cksum 0xa691 (correct), ack 5809, win 4099, length 0
01:36:33.440662 IP (tos 0x0, ttl 128, id 41196, offset 0, flags [DF], proto TCP (6), length 76)
    192.168.3.12.58038 > 192.168.3.40.22: Flags [P.], cksum 0x954f (correct), seq 3238:3274, ack 5809, win 4099, length 36
01:36:33.442526 IP (tos 0x10, ttl 64, id 41935, offset 0, flags [DF], proto TCP (6), length 76)
    192.168.3.40.22 > 192.168.3.12.58038: Flags [P.], cksum 0x87c3 (incorrect -> 0x0454), seq 5809:5845, ack 3274, win 501, length 36
01:36:33.484199 IP (tos 0x0, ttl 128, id 41197, offset 0, flags [DF], proto TCP (6), length 40)
    192.168.3.12.58038 > 192.168.3.40.22: Flags [.], cksum 0xa649 (correct), ack 5845, win 4099, length 0
01:36:34.347440 IP (tos 0x0, ttl 128, id 41198, offset 0, flags [DF], proto TCP (6), length 76)
    192.168.3.12.58038 > 192.168.3.40.22: Flags [P.], cksum 0xf192 (correct), seq 3274:3310, ack 5845, win 4099, length 36
01:36:34.355579 IP (tos 0x10, ttl 64, id 41936, offset 0, flags [DF], proto TCP (6), length 84)
    192.168.3.40.22 > 192.168.3.12.58038: Flags [P.], cksum 0x87cb (incorrect -> 0x9bdc), seq 5845:5889, ack 3310, win 501, length 44
01:36:34.396949 IP (tos 0x0, ttl 128, id 41199, offset 0, flags [DF], proto TCP (6), length 40)
    192.168.3.12.58038 > 192.168.3.40.22: Flags [.], cksum 0xa5f9 (correct), ack 5889, win 4099, length 0
01:36:35.595826 IP (tos 0x0, ttl 128, id 41200, offset 0, flags [DF], proto TCP (6), length 76)
    192.168.3.12.58038 > 192.168.3.40.22: Flags [P.], cksum 0x176b (correct), seq 3310:3346, ack 5889, win 4099, length 36
01:36:35.596736 IP (tos 0x10, ttl 64, id 41937, offset 0, flags [DF], proto TCP (6), length 92)
    192.168.3.40.22 > 192.168.3.12.58038: Flags [P.], cksum 0x87d3 (incorrect -> 0xb1b2), seq 5889:5941, ack 3346, win 501, length 52
01:36:35.600119 IP (tos 0x10, ttl 64, id 41938, offset 0, flags [DF], proto TCP (6), length 204)
    192.168.3.40.22 > 192.168.3.12.58038: Flags [P.], cksum 0x8843 (incorrect -> 0x5837), seq 5941:6105, ack 3346, win 501, length 164
